{
  "schema_version": "bb-trace-events/v1",
  "provenance": {
    "baseline_id": "13ba4949da69c61e6cd8258b3c097113e69a6dee494c7878688853cca65dea60",
    "material": {
      "evidence_class": "synthetic",
      "source": {
        "repository": "shadps4-emu/shadPS4",
        "commit": "e3ce810f3a653f43ac64ebab63023de281a4103a",
        "patches_sha256": "e3b0c44298fc1c149afbf4c8996fb92427ae41e4649b934ca495991b7852b855"
      },
      "target_manifest_sha256": "1111111111111111111111111111111111111111111111111111111111111111",
      "host_manifest_sha256": "2222222222222222222222222222222222222222222222222222222222222222",
      "scenario_sha256": "3333333333333333333333333333333333333333333333333333333333333333",
      "emulator_config_sha256": "4444444444444444444444444444444444444444444444444444444444444444",
      "producer": {
        "producer_id": "bb-trace-event-model",
        "producer_sha256": "3f92a708bb9763e441a2267138b6665c0229fc573e8c65602c92cd408b99c047",
        "schema_sha256": "e01e2b07e65e1030b513bf51a36a35a1e6b63273faefdaae9312edee602f2e75"
      }
    }
  },
  "capture": {
    "clock": "monotonic_ns",
    "limits": {
      "max_events": 16,
      "max_buffer_bytes": 65536
    },
    "filter": ["resource", "access", "sync"],
    "sampling": {
      "mode": "all",
      "every_n": 1
    }
  },
  "events": [
    {
      "seq": 0,
      "timestamp_ns": 100,
      "category": "resource",
      "kind": "create",
      "correlation": {"resource_id": "res:00000001"},
      "size_bytes": 4096
    },
    {
      "seq": 1,
      "timestamp_ns": 120,
      "category": "access",
      "kind": "guest_cpu",
      "correlation": {"resource_id": "res:00000001"},
      "access": "write",
      "coverage": "observed"
    },
    {
      "seq": 2,
      "timestamp_ns": 140,
      "category": "access",
      "kind": "host_gpu",
      "correlation": {"resource_id": "res:00000001"},
      "access": "read",
      "coverage": "observed"
    },
    {
      "seq": 3,
      "timestamp_ns": 160,
      "category": "sync",
      "kind": "barrier",
      "correlation": {
        "resource_id": "res:00000001",
        "queue_id": "queue:00000000"
      }
    },
    {
      "seq": 4,
      "timestamp_ns": 180,
      "category": "access",
      "kind": "guest_cpu",
      "correlation": {"resource_id": "res:00000001"},
      "access": "read",
      "coverage": "ambiguous"
    },
    {
      "seq": 5,
      "timestamp_ns": 200,
      "category": "resource",
      "kind": "destroy",
      "correlation": {"resource_id": "res:00000001"}
    }
  ],
  "summary": {
    "recorded_events": 6,
    "dropped_events": 0,
    "buffer_high_water_bytes": 2048,
    "instrumentation_cpu_ns": 700,
    "serialization_cpu_ns": 250
  }
}
